{
  "instance_id": "gpmlm",
  "contract_version": "1.3.0",
  "generated_at": "2026-07-11T09:30:00Z",
  "cursor": "",
  "next_cursor": "",
  "has_more": false,
  "contacts": [
    {
      "user_id": "usr_demo_001",
      "tenant_id": "tenant_alpha",
      "email": "product-owner@example.test",
      "communication_eligible": true,
      "active": true,
      "opted_out": false,
      "role_key": "manager",
      "opt_out_reason": ""
    }
  ]
}
